id,公司名称,关联公司名称,岗位,岗位描述,岗位标签,待遇,学历,所在城市,发布时间
127,奇安信科技集团股份有限公司,奇安信科技集团股份有限公司,服务端开发工程师-JAVA,<$&0006&$><$&0007&$>    <$&0006&$><$&0007&$>        岗位职责1、参与研发部门整体的服务端基础架构设计、开发和升级维护；2、负责团队内部相关产品的后端架构设计、研发和优化工作；3、根据产品需求完成产品的模块设计、编码和测试工作；4、与产品、前端、客户端同学密切配合完成项目目标；5、按照项目计划，按时提交高质量代码，完成开发任务；6、完成服务端相关文档的编写；7、与研发团队成员进行技术交流，互相促进技术能力的提升。岗位要求1、计算机相关专业本科及以上学历或具备同等能力；2、具有良好的数据结构和算法基础；3、能熟练使用 Java 语言，对语言中的核心知识有深入了解；有以下任何一项经验的更佳：4、熟悉 TCP/IP/HTTP 协议者优先；5、熟悉mysql/nginx/redis等开源软件的内部原理者优先。,,1.5-2万,本科,,2022-03-30 00:00:00
128,金徽酒股份有限公司,金徽酒股份有限公司,市场营销,<$&0006&$><$&0007&$>    <$&0006&$><$&0007&$>        （1）全日制本科二本及以上学历；（2）掌握一定市场营销专业知识，具备良好市场分析、判断能力以及客户服务意识； （3）具有较强的沟通能力、执行力；（4）有团队协作精神，善于挑战。,,6-8千/月,本科,陇南市,2017-06-09 00:00:00
129,金徽酒股份有限公司,金徽酒股份有限公司,市场营销,<$&0006&$><$&0007&$>    <$&0006&$><$&0007&$>        （1）全日制本科二本及以上学历；（2）掌握一定市场营销专业知识，具备良好市场分析、判断能力以及客户服务意识； （3）具有较强的沟通能力、执行力；（4）有团队协作精神，善于挑战。,,6-8千/月,本科,陇南市,2017-06-09 00:00:00
130,中国平安财产保险股份有限公司海南分公司,中国平安财产保险股份有限公司海南分公司,琼中支公司综合服务岗,<$&0006&$><$&0007&$>    <$&0006&$><$&0007&$>        工作职责要求：1.负责各种印章、证照的管理，职场管理，设施维护；2.负责会务组织、接待工作；3.负责资产管理、简单软硬件维护或协调；4.负责团队管理、销售激励，推动支公司、销售团队达成各项业绩指标；5.对接机构合规管理工作。任职资格：1.本科及以上学历，专业不限；2.有良好的沟通能力和再学习能力；3.熟练掌握办公软件，保险行业工作经验者优先。,,4-6千,本科,琼中黎族苗族自治县,2023-05-08 00:00:00
131,重庆瑜欣平瑞电子股份有限公司,重庆瑜欣平瑞电子股份有限公司,外贸专员,【岗位职责】1.根据客户提供的信息确认产品型号；2.跟进和处理国内和国外客户的订单全流程，包括报价，接收订单，下单给内部，收款，发货，开票，对账等；3.主动开发国内和国外新客户，使用网站搜索，海关数据等方式；4.公司国外子公司的进出口业务跟进，包括接收子公司的订单，制作报关资料等；5.每月末的所有客户的对账开票；【任职要求】学历大专及以上，会简单的英文，有外贸跟进和内勤工作经验优先,对账发货开票英文收款内勤海关数据进出口业务对账开票报价,5-7千,大专,九龙坡区,2025-08-04
132,招商银行股份有限公司漳州分行,招商银行股份有限公司漳州分行,招商银行厅堂助理,<$&0006&$><$&0007&$>    <$&0006&$><$&0007&$>        ・岗位职责：1.派驻营业网点，负责厅堂信用卡申请客户业务填单、业务受理；2.配合厅堂进行客户引流，基础业务营销转介；3.配合支行或市场团队联合进企，负责信用卡业务受理；4.存量客户维护，日常推送我行优惠活动，提升我行品牌影响力，促成客户转介与需求业务的办理。・岗位要求： 1.大专（含）以上学历，专业不限；2.综合能力强，具有良好的业务沟通能力和协调能力；3.服务客户意识强，能承受高压力工作，勇于接受挑战，能吃苦耐劳，有团队意识；4.思想品德高尚，综合素质过硬，有较高的风险责任意识。・薪资福利（1）底薪+提成+月度激励+福利补贴（保护期底薪3000元）；（2）入职后开始缴纳五险一金；（3）福利：车辆补贴、节日福利、生日福利等。,银行,3-6千,大专,漳州市,2023-06-08 00:00:00
133,广州视源电子科技股份有限公司,广州视源电子科技股份有限公司,质量专家（6sigma）,岗位职责：一、策划与实施质量改进专案管理工作，为业务经营产生效益1、策划和建立集团级持续改善体系框架（整合精益生产、六西格玛等），建立质量改进文化2、负责集团全生命周期质量工具的持续改善，推广质量工具应用3、统筹重大客诉/市场失效问题的根本原因分析（如8D、5Why法），建立逆向问题闭环管理机制4、主导和推进跨领域产品整改组的建立和运作，制定整改活动KPI及激励机制5、组织集团级改善成果评审会，萃取***实践并在集团内复制推广二、规划质量人才专业赋能，建立质量工具应用标准及培训体系，推广质量专业工具与方法论在业务中实践任职要求：1、10年以上制造业质量管理经验，5年以上集团级改善体系搭建履历，汽车/电子/装备制造等离散型制造业背景优先2、精通质量工具（FMEA/SPC/MSA）及改善方法论（精益六西格玛黑带），熟练掌握Minitable/JMP等数据分析工具，具备DFSS应用经验3、有成功主导过集团级质量改善项目，具备跨部门协同及冲突解决能力，能驱动研发/生产/供应链联动4、能将质量改善目标与公司战略对齐（如降本、交付提速），具备质量风险前瞻性预判及预防机制设计能力5、具备优秀的沟通影响力，能向管理层汇报改善成果并获取资源支持，擅长通过激励机制推动全员改善文化渗透,SPC8D报告QC七大手法ISO9001精益生产kpi8d培训体系质量工具激励机制规划专案管理质量改进,2.5-4万·13薪,大专,广州市,2025-11-06
134,海南普利制药股份有限公司,海南普利制药股份有限公司,云南招商经理,<$&0006&$><$&0007&$>    <$&0006&$><$&0007&$>        岗位职责：1、负责公司产品在的所辖区域销售和市场拓展工作（红河、文山）；2、负责完善区域经销商网络；负责所辖区域经销商的管理；3、负责或协助公司产品在所辖区域的招标、物价、医保等事务；4、及时收集和反馈客户信息及市场信息；5、负责或协助公司其他相关业务在区域内的开展。任职资格1、 市场营销、医药学专业背景，专科及以上学历；2、 掌握医学/药学知识，熟练应用团队管理、营销管理相关知识与技能；3、 2年以上招商经验；4、 身体健康，精力充沛，能够适应出差。,,4-6千/月,大专,,2021-04-23 00:00:00
135,成都长城开发科技股份有限公司,成都长城开发科技股份有限公司,sqe供应商质量工程师,"【岗位职责】1、供应商评估与选择：1）评估潜在供应商的能力和资质，包括技术、生产能力、质量管理体系等。2）对供应商进行现场审核，并对审核发现的问题进行跟踪直至关闭2、供应质量管理：1）监控供应商的生产过程，确保其符合工艺要求和质量标准。2）进行供应商过程审核，以评估其过程能力和质量控制措施的有效性。3）确保供应商能够提供稳定可靠的产品，并有能力满足交付时间和数量的要求。3、质量问题解决：1）与供应商一起解决开发生产以及终端客户发现的与物料相关的质量问题，包括不合格品、产品退回和客户投诉等。2）进行质量问题调查和分析，制定纠正措施和预防措施，确保问题不再发生。3）建立并维护供应商的品质改进计划，推动供应商的持续改进和提升。4、供应商培训与支持：1）提供供应商培训和技术支持，确保供应商了解和理解产品质量要求。2）通过定期沟通和会议与供应商保持密切合作关系，促进信息共享和问题解决。5、质量数据分析和报告：1）收集、分析和报告与供应商相关的质量数据，包括供应商绩效指标、不合格品率等。2）基于数据分析结果，制定改进计划和建议，提升供应商质量水平和整体绩效。6、部门协同：负责对接供应商配合公司为了整体产品品质提升，效率提升而提出的物料改善。【任职资格】1、大学本科或以上学历，工科类专业；2、3年以上电子行业研发或者质量管理（PQE,SQE）工作经验；3、了解常见电子元器件的基本原理，熟悉制造流程与常见失效；4、熟练运用如GRR\SPC\3A\排列图\鱼骨图\Minitab等工具对数据进行收集和分析，为决策提供依据；5、掌握质量管理基础、供应商与客户关系管理、质量体系、检验等相关知识;熟练掌握ISO9000/14000，IPC610，JEDEC等通用标准；6、沟通表达能力优秀、抗压能力强。",数据分析电子元器件质量管理spc质量控制质量管理体系质量体系客户投诉minitabsqe,8千-1.3万·14薪,本科,成都市,2025-05-14
136,中国平安人寿保险股份有限公司湖南分公司,中国平安人寿保险股份有限公司湖南分公司,保单整理专家,<$&0006&$><$&0007&$>    <$&0006&$><$&0007&$>        1、与客户取得联系，及时将客户的地址、电话等涉及到保单的关键信息更新，协助客户及时办理各类信息的变更。2、在期限到达时，协助客户办理保全变更、生存金、返还金、保单红利等收益的领取。3、运用专业的人身保险，理财知识，协助客户厘清保险条款、保单保障内容等，协助客户不定期进行保单整理，出具保单整理报告。4、以客户需求为导向，为客户提出完善建议.帮助客户完善风险保障，代表公司及时送上祝福和关心，让客户享受及时、便捷的服务。5、为客户提供理财、风险保障和医疗保障的咨询顾问服务，及时提醒客户保险行业、保险产品的变动情况。,,5千-1万,大专,长沙市,2023-07-10 00:00:00
137,深圳市中科蓝讯科技股份有限公司,深圳市中科蓝讯科技股份有限公司,视频算法工程师-ISP方向（珠海）,<$&0006&$><$&0007&$>    <$&0006&$><$&0007&$>        岗位职责：1、负责  ISP 相关算法的研究和落地，包括3A、HDR、插帧、去雾等；2、根据算法需求收集数据，建立图像质量评价指标，测试算法性能，撰写与维护算法文档；3、负责图像、视频 ISP 相关领域的算法预研、设计、优化、验证、调优支持等工作；4、配合芯片、应用设计工程师完成算法设计与调试。任职资格：学历：硕士及以上学历；专业：电子、通信、光学、计算机、模式识别、数学、物理等相关专业；1、掌握Matlab 、C/C++、python等语言编程其中一种或多种；2、扎实的数学理论、数字信号处理基础；3、有 2 年以上视频 ISP 相关算法研发经验，有量产芯片ISP 算法经历者优先；4、具有扎实的编程功底，良好的设计能力和编程习惯。工作地点：珠海,计算机<$&0007&$>电子<$&0007&$>c++<$&0007&$>编程<$&0007&$>通信<$&0007&$>数学<$&0007&$>物理<$&0007&$>matlab<$&0007&$>光学<$&0007&$>数字信号处理,2-4万·16薪,硕士,深圳市,2024-05-31 00:00:00
138,甘源食品股份有限公司,甘源食品股份有限公司,推广专员,岗位职责：1、省区推广活动的培训、教导；2、分析活动执行效果和数据，对区域推广活动的总结和效果分析；3、后期推广活动的规划执行和总结；任职要求：1、大专以上学历；2、1年以上推广活动规划执行工作经验（有快消品推广经验者优先）；3、能吃苦耐劳，适应出差，沟通协调能力强，服从公司安排；工作地点：长沙市雨花区湘府东路168号（省植物园北门）<$&0005&$><$&0005&$><$&0005&$><$&0005&$><$&0005&$><$&0005&$><$&0005&$><$&0005&$><$&0005&$><$&0005&$><$&0005&$><$&0005&$><$&0005&$><$&0005&$><$&0005&$>上班地址：湖南省长沙市雨花区华文森林林酒店11楼<$&0005&$><$&0005&$><$&0005&$><$&0005&$><$&0005&$><$&0005&$><$&0005&$><$&0005&$><$&0005&$>,,,,长沙市,2015-09-17 00:00:00
139,深圳精智达技术股份有限公司,深圳精智达技术股份有限公司,算法研究员,"<$&0006&$><$&0007&$>    <$&0006&$><$&0007&$>        工作职责:1、负责新产品/新需求项目的算法设计/算法开发，满足达成项目规划的目标。2、通过分析测试，对现有产品的算法进行升级优化。3、调研新方法/新技术，做可行性分析，制定新技术落地应用方案。4、分析处理产品售后的算法问题，客户现场产品调试。5、撰写相关算法开发文档，定期输出工作总结文档，并与组内成员分享。6、制作产品算法相关的使用教程，对应用工程师/技术支持等相关人员进行培训。任职资格:1、计算机、模式识别或图像处理相关研究方向，计算机、电子信息工程、自动化等相关专业；硕士3年以上或本科5年以上工作经验，工作经验丰富者优先。2、熟练掌握C/C#/C++/Matlab中至少一门语言，能够熟练使用Matlab/OpenCV/Halcon等相关图像处理工具。3、具有3年以上项目开发经验，能独立设计视觉相关算法、开发算法及调试优化，对面板显示和半导体行业有了解优先4、对机器视觉领域前沿技术感兴趣，有AOI相关经验优先",Halcon<$&0007&$>Matlab<$&0007&$>OpenCV<$&0007&$>c++<$&0007&$>机器视觉<$&0007&$>图像处理<$&0007&$>AOI<$&0007&$>模式识别,2.5-4万・13薪,硕士,深圳市,2022-06-11 00:00:00
140,中国核工业建设股份有限公司,中国核工业建设股份有限公司,法律审计,工作职责：(纪检监督部、董事会办公室)需求专业：法律、法学、审计学、会计学、财政学、税收学、国际金融、经济学等相关专业。任职资格：(1)全日制研究生硕士及以上；(2)专业排名前30%；(3)通过CET6考试或通过同等水平外语等级考试，党员优先；(4)认同企业文化、较强的麦任心，良好的沟通表达能力；(5)有大型企业实习经验、学生会干部经历等。,会计学法律经济学法学审计学外语国际金融财政学cet6税收学,15-18万/年,硕士,浦东新区,2025-04-23
141,陕西华达科技股份有限公司,陕西华达科技股份有限公司,信息化推动办负责人,<$&0006&$><$&0007&$>    <$&0006&$><$&0007&$>        ***，根据个人能力定薪。岗位职责：1、负责实施公司信息化建设方案，保证实施质量；2、负责修订和完善公司信息系统管理制度；3、保证公司网络系统的安全性，按照国家规定，做好信息方面的保密工作；4、把控公司各信息化项目的实施进度及标准，独立处理解决项目实施过程中的各类困难，确保公司信息化项目按进度实施；5、定期组织开展信息技术培训，全面提升信推办整体技术能力，负责公司信息化的普及推广，进一步提升信息化办公效率，提高信息化管理水平；6、调查研究公司目前信息化实施状态，与各相关部门及系统供应商进行沟通协调，确保信息化项目实施效果，用管理能力和手段进一步优化项目方向。工作要求：1、年龄40岁以下，统招本科及以上学历，信息管理与信息系统、计算机科学与技术相关专业；2、具备信息管理中级或以上资格认证；3、同类岗位工作10年以上，具备丰富的企业信息化改革及管理经验，有统筹搭建公司信息化系统相关经验；4、具备较强的专业技术能力，能及时了解、掌握信息技术发展动态，务实解决与防范公司信息管理中的问题，保障公司信息系统运行的安全、稳定、高效；5、熟练掌握制造业信息化改革过程中所有信息管理系统的相关操作、管理、维护知识，并具备一定的业务流程优化经验；6、具备良好的综合素质，熟悉制造业基本管理流程，有一定的企业管理知识与管理能力，包括但不限于财务管理、供应链管理、生产管理以及人力资源管理等知识能力；7、具备优秀的组织协调能力及分析判断能力，出色的逻辑思维能力、执行力和应变能力。,信息管理,9-12万/年,本科,西安市,2022-03-21 00:00:00
142,神驰机电股份有限公司,神驰机电股份有限公司,体系管理经理,<$&0006&$><$&0007&$>    <$&0006&$><$&0007&$>        1、全面掌握质量管理体系的基本要求，建立健全公司质量管理体系，维持公司体系的有效运行，并适时向领导汇报运行情况；2、负责指引集团下属各分公司标准化文件的编辑、修订、发放、 维护和归档管理；3、负责组织实施相关的内部体系审核（产品审核、内审、过程审核、管理评审等）；4、协调和接受来自顾客和第三方的审核工作，直至达到体系认证与客户的要求。,,0.6-1.2万/月,大专,北碚区,2020-09-10 00:00:00
143,浙江金沃精工股份有限公司,浙江金沃精工股份有限公司,储备干部,<$&0006&$><$&0007&$>    <$&0006&$><$&0007&$>        1、22-35岁，本科学历，男女不限                             2、机械类相关专业优先,,0.7-1.2万/月,本科,衢州市,2021-09-19 00:00:00
144,中国平安财产保险股份有限公司中山中心支公司,中国平安财产保险股份有限公司中山中心支公司,远程一体化服务作业岗,<$&0006&$><$&0007&$>    <$&0006&$><$&0007&$>        （1）负责小额车险车物案件/车险人伤案件/意健险案件线上查勘，核实事故真实性，判定事故责任及保险责任，指引客户理赔；（2）负责案件损失确定，线上提供解答客户理赔咨询服务，在线与客户协商确定理赔方案，指引客户索赔。,理赔<$&0007&$>车物案件<$&0007&$>理赔咨询<$&0007&$>理赔方案,7千-1万,本科,广州市,2023-08-21 00:00:00
145,湖南方盛制药股份有限公司,湖南方盛制药股份有限公司,分析研究员(工作地点长沙）,<$&0006&$><$&0007&$><$&0005&$><$&0005&$><$&0005&$><$&0005&$><$&0005&$><$&0006&$><$&0007&$><$&0005&$><$&0005&$><$&0005&$><$&0005&$><$&0005&$><$&0005&$>岗位职责：1、根据注册法规要求，完成课题的质量分析研究工作；2、在项目负责人的指导下，完成注册申报资料的撰写，并完成原始记录的填写；3、实验室日程卫生的清洁，实验设备的日常维护保养。任职要求：1、本科以上学历，药学或化学相关专业； 2、了解新药注册法规和指导原则的技术要求，熟悉药品管理规范和有关法规；3、有一年以上分析工作经验，熟悉申报资料撰写及原始记录；熟练使用各种常规分析仪器及日常维护。薪资福利：1、薪资：具体根据个人能力而定；2、购买社保（养老、医疗、失业、生育、工伤）及住房公积金；实习生购买商业意外险；3、提供免费三餐；4、提供免费上下班交通车/车补；5、提供公寓宿舍（独立卫生间、阳台、空调）；6、享受带薪国家法定节假日：春节、劳动节、国庆节、元旦节、端午节、中秋节、清明节；7、享受带薪休假：年假、婚假、产假、陪产假、病假等；8、中高层及老员工旅游、全员季度活动、羽毛球协会等员工活动；9、生日礼品礼金、传统节日礼品礼金、结婚礼金、其它慰问金等；10、项目奖金、年终奖金；11、老员工年度体检；12、提供每季度一次内部晋升机会，提供每年一次薪资上调机会；13、高管及核心岗位享有股权激励；14、公司为员工提供系统的培训、公平的晋升平台、良好的职业发展通道。,,4-6千/月,本科,长沙市,2017-06-02 00:00:00
146,科大国创软件股份有限公司,科大国创软件股份有限公司,商务专员/助理,<$&0006&$><$&0007&$>    <$&0006&$><$&0007&$>        岗位职责：1、供应商资料的统计、归档工作；2、负责项目货物的询价、比价和采购工作。3、了解和搜集原厂商资料及竞争产品的动态信息；4、定期对供应商渠道、价格体系和市场价格进行调查。任职资格：1、专科及以上学历，从事弱电智能化行业商务工作的优先考虑；2、能熟练使用常规的办公软件；3、有较强的沟通能力；4、做事认真、细心、负责、能吃苦耐劳；,,6-8千/月,大专,合肥市,2019-09-17 00:00:00
147,中国平安财产保险股份有限公司湖南分公司,中国平安财产保险股份有限公司湖南分公司,农险客户经理,<$&0006&$><$&0007&$>    <$&0006&$><$&0007&$>        工作职责：1.搭建、维护当地政府关系，在与政府接触中挖掘政、农业务商机；2.提高农业保险中标区域承保率；3.管控业务品质；4.农网建设；5.负责承保理赔档案的完整性、真实性；6.农商险业务需求调研、计提及业务拓展。岗位要求：1.本科以上学历，农学相关专业优先；2.工作认真负责，有较强的服务意识；3.能吃苦耐劳,,4-6千,本科,郴州市,2023-07-25 00:00:00
148,中国平安财产保险股份有限公司湖南分公司,中国平安财产保险股份有限公司湖南分公司,农险客户经理,<$&0006&$><$&0007&$>    <$&0006&$><$&0007&$>        工作职责：1.搭建、维护当地政府关系，在与政府接触中挖掘政、农业务商机；2.提高农业保险中标区域承保率；3.管控业务品质；4.农网建设；5.负责承保理赔档案的完整性、真实性；6.农商险业务需求调研、计提及业务拓展。岗位要求：1.本科以上学历，农学相关专业优先；2.工作认真负责，有较强的服务意识；3.能吃苦耐劳,,4-6千,本科,郴州市,2023-07-25 00:00:00
149,北京恒通创新赛木科技股份有限公司,北京恒通创新赛木科技股份有限公司,市场/营销专员,<$&0005&$><$&0005&$><$&0005&$><$&0005&$><$&0005&$><$&0005&$><$&0005&$><$&0005&$><$&0005&$><$&0005&$><$&0005&$>岗位职责1、专业人员职位，在上级的领导和监督下定期完成量化的工作要求，并能独立处理和解决所负责的任务；2、协助上级管理、协调市场，跟踪并监察各项市场营销计划的执行；3、协助对公司产品的市场调研活动；4、负责公司的广告定期制作及宣传工作；5、收集市场同行业信息，参与策划有关公司产品的发布、展会等活动。任职资格1、大专以上学历，营销、管理类专业为佳；2、熟悉___建材__行业，有销售和管理经验者优先；3、具备思维活跃、有积极进取的精神及接受挑战的性格；4、为人诚实、正直，性格开朗、责任心强，擅长与人沟通；5、有一定的组织协调能力，能承担和突破工作压力，是很好的时间管理者和自我任务驱动者。,销售<$&0005&$><$&0005&$><$&0005&$><$&0005&$><$&0005&$><$&0005&$><$&0005&$><$&0005&$><$&0005&$><$&0005&$><$&0005&$><$&0005&$><$&0005&$><$&0005&$><$&0005&$><$&0005&$><$&0005&$>建材销售<$&0005&$><$&0005&$><$&0005&$><$&0005&$><$&0005&$><$&0005&$><$&0005&$><$&0005&$><$&0005&$><$&0005&$><$&0005&$><$&0005&$><$&0005&$><$&0005&$><$&0005&$><$&0005&$><$&0005&$>直销,3-4.5千/月,,房山区,2016-03-25 00:00:00
150,深圳市富恒新材料股份有限公司,深圳市富恒新材料股份有限公司,研发助理工程师,<$&0006&$><$&0007&$><$&0005&$><$&0005&$><$&0005&$><$&0005&$><$&0005&$><$&0005&$>1.全日制硕士及以上学历，高分子材料或材料相关专业； 2.应届生或有相关工程塑料改性合成相关工作经验者优先。 注：1、本岗位薪资为月薪+提成。2、提供标准单间宿舍，入职即买五险一金。,,,硕士,深圳市,2017-04-08 00:00:00
