id,公司名称,关联公司名称,岗位,岗位描述,岗位标签,待遇,学历,所在城市,发布时间
287,常州时创能源股份有限公司,常州时创能源股份有限公司,气化技术员,"<$&0006&$><$&0007&$>    <$&0006&$><$&0007&$>        岗位职责:1、负责固定床气化的开车调试、生产运行、日常维保。2、负责项目进度的整体统筹,包括施工安装、系统调试、完工验收等。3、负责解决运行过程中出现的问题,以及突发情况的处理。4、负责与甲方进行协调,对甲方运行操作人员进行操作培训5、负责收集并分析运行数据,及时进行工作反馈。任职要求:1、大专学历有1年以上有能源环保行业经验者优先。2、要求全职,倒班制度。3、职业道德良好,有责任心,较强的组织能力及沟通表达能力。",工业废气<$&0007&$>除尘<$&0007&$>烟气,0.9-1万/月,大专,常州市,2022-06-01 00:00:00
288,中国平安财产保险股份有限公司浙江分公司,中国平安财产保险股份有限公司浙江分公司,车商客户经理（金华）,<$&0006&$><$&0007&$>    <$&0006&$><$&0007&$>        岗位职责：1、负责所辖网点合作关系的日常维护；2、协调处理车商网点销售、理赔过程中的简单问题；3、车商服务对接沟通工作，相关业务处理。任职要求：1、本科及以上学历，专业不限；1、具有良好的服务意识和责任心；2、具有一定的沟通协调能力；3、具有较强的电脑操作能力。,,8-12万/年,本科,金华市,2023-01-14 00:00:00
289,中国平安财产保险股份有限公司重庆分公司,中国平安财产保险股份有限公司重庆分公司,0361WN-品牌宣传岗 (职位编号：0361WN),<$&0006&$><$&0007&$>    <$&0006&$><$&0007&$>        1、负责公司品牌宣传活动的策划、组织与执行全流程工作。2、负责公司自媒体平台（包括但不限于微信公众号、分公司电视晨会等）建设和日常运营工作，公司新闻稿件撰写、编审与发布。3、参与公司大型活动的策划、组织和执行。4、完成领导交办的其他任务。  任职资格：1、本科及以上学历，互联网专业背景优先。2、文字功底强，具有优秀的审美与创意设计能力，具备基本的视频剪辑及平面设计技能。3、有工作热情，沟通协调能力强。4、具有较强的责任心、具备高效的执行力、服务意识强、抗压性强。,,6-8千,本科,江北区,2023-07-28 00:00:00
290,湖南九典制药股份有限公司,湖南九典制药股份有限公司,体系工程师,<$&0006&$><$&0007&$>    <$&0006&$><$&0007&$>        岗位职责：1、负责审核监督文件管理规程的执行。2、负责协调文件变更引起相关文件变更的评估。3、按要求协调和组织文件定期复审，保证文件的可执行性。4、负责客户审计的接待工作以及审核后的情况追踪。5、有药品生产企业GMP认证经验，参加过国外体系认证（如FDA、KFDA）及国外客户审计经验尤佳。任职要求：1、本科及以上学历，药学相关专业；2、熟悉药品生产企业GMP管理要求，熟悉药品质量管理要素的要求；3、有药品生产企业GMP认证经验，参加过国外体系认证（如FDA、KFDA）及国外客户审计经验尤佳,GMP<$&0007&$>质量管理,0.7-1万/月,本科,长沙市,2020-07-27 00:00:00
291,广州市金钟汽车零件股份有限公司,广州市金钟汽车零件股份有限公司,模具维修（驻外）,【工作内容】-负责模具的日常维护、检修及故障排除；-配合生产部门进行模具调试与优化，确保生产顺利进行；-根据生产需求提供技术支持和解决方案；-定期对模具使用情况进行跟踪与反馈，提升设备运行效率。【任职要求】-具备良好的沟通能力和责任心，能适应长期驻外工作；-对机械结构、模具原理有基本了解，有相关经验者优先；-能吃苦耐劳，具备较强的学习能力和动手能力；-有团队合作精神，能够独立完成工作任务。,,7千-1万,中技,广州市,2025-12-09
292,苏州晶方半导体科技股份有限公司,苏州晶方半导体科技股份有限公司,采购专员-生产设备方向,<$&0006&$><$&0007&$>    <$&0006&$><$&0007&$>        岗位职责1、按照公司采购制度流程，负责供应商开发考核、市场寻比议价、成本分析、合同谈判、交期跟催、对账请款等采购工作；2、及时把握市场行情变化趋势，分析价格变化合理性；3、对接公司各需求单位，保障品质、服务及交期；4、主要负责半导体封测设备与维修，以及与生产相关的其他采购事项。任职资格1、大专及本科及以上学历，在半导体行业采购岗位2年以上；2、熟悉采购体系管控逻辑，熟悉采购流程；3、对供应商报价成本等数据有较强的分析能力；4、具备供应商绩效考核与过程管控的经验；5、逻辑思维强，对外具备商务谈判能力，对内具备沟通协调能力；6、半导体行业采购从业经验更佳；7、具良好的英文应用能力，熟悉ERP系统操作；8、具良好的职业道德，认真踏实，责任心强，抗压力强。,,0.6-1万/月,大专,苏州市,2021-09-18 00:00:00
293,浙江锋龙电气股份有限公司,浙江锋龙电气股份有限公司,软件工程师,<$&0006&$><$&0007&$>    <$&0006&$><$&0007&$>        大专及以上学历，计算机专业，三年以上工作经验，熟悉ERP软件运行维护，熟悉JAVA编程。1.负责新系统、新程序的技术调研工作。2.负责与需求人员对接，熟悉项目的需求规划说明。3.负责与外部软件开发商对接，熟悉项目的开发计划，并依据公司自身需求提出软件开发需求，并加以实施。4.按计划完成功能模块的功能设计、代码实现，代码编写和单元测试。5.负责调研公司各部门信息化需求并汇总，负责公司外购软件的二次开发。参与需求和设计的讨论，对项目开发各个环节进行确认。,软件开发<$&0007&$>软件<$&0007&$>开发<$&0007&$>技术支持<$&0007&$>计算机,0.8-1万/月,大专,绍兴市,2021-05-04 00:00:00
294,沈阳兴齐眼药股份有限公司,沈阳兴齐眼药股份有限公司,设备验证工程师,<$&0006&$><$&0007&$>    <$&0006&$><$&0007&$>        起草、修订验证相关文件及记录；能够独立完成工艺验证的方案起草，执行；参与质量体系涉及的相关工作（偏差、CAPA、质量风险及变更管理；自检与外检等）。掌握GMP等药品生产相关法律法规，熟悉无菌药品生产管理流程及关键质量控制点。有良好的沟通和协调能力以及发现问题和解决问题的能力。药学及相关专业,,6-9千,本科,沈阳市,2023-06-15 00:00:00
295,中国平安人寿保险股份有限公司成都市金堂支公司淮口营销服务部,中国平安人寿保险股份有限公司成都市金堂支公司淮口营销服务部,保险规划师,<$&0006&$><$&0007&$>    <$&0006&$><$&0007&$>        @我们希望您是：年龄：25-45岁学历：大专(含)以上经验：具有一定的金融知识，且要能用于突破、敢于坚持人品：真诚，且具有团队精神       @您可以收获到什么？    工资收入：付出与收入成正比的工资收入，公司为符合标准的人才提供专属新人津贴、销售提成、季度奖等，具备优秀资源者可在公司实现可观收入    医疗保障：根据不同职级提供重疾、住院医疗、意外保障    养老补贴：绩优人员享有特别养老补贴    优质待遇及晋升机制，成长空间巨大，是我们的优势。 (产品佣金 + 管理津贴 + 季度奖 + 年终奖 + 公司各项福利 + 商业保险)***什么样的工作可以满足？——要收入无上限——要时间相对自由——要突破事业瓶颈——要挑战不同行业——要不易被替代——要实现自我价值——越老越吃香，退休了还有被动收入***销售，3分学习，7分靠打拼***    无论你是否在做销售工作，其实人人都是销售员，一辈子都在做销售，销售你的工作，销售你的潜能，销售你的价值观，在做个人品牌。    一直在学习的工作，或工作中一直有不确定性，才不易被取代。销售是人与人打交道，人的思想是不会被既定，故销售是长期积累且不易被取代的事业！***黄金35年，做复利式工作***    每个人工作到退休短短35年，我们要用35年黄金工作时间，做正确的努力，做复利式工作。    ！！！选择正确的行业，好的公司（平台），显得尤为重要！！！    什么是正确的行业？能跟着国家政策走的行业，可以参考哪些可以拿到国家政府建设项目。    什么是好的公司（平台）？能带着你挣钱的公司；要带着你挣钱的公司，那么它的盈利能力一定很强。***中国平安，三大综合金融集团之一，全球保险行业领先**    中国平安集团具有保险、银行、投资、金融科技全系列，近年来更是深耕领先布局居家养老和高端养老资源，整合了全国知名医院和医生资源，打造大健康环境，解决未来养老难、医疗资源紧缺等社会问题！    2023年度《财富》世界500强，中国平安以1815.66亿美元的营业收入位列全球第33位，排名全球金融企业第5位、中国金融企业第4位，自2019年起连续5年蝉联全球保险企业顶峰。***团队的愿景，做保险企业家***    我们的愿景不是一名保险代理人、不是单一的理财顾问、养老管家、家庭医生.......，我们立志要成为一名保险企业家，具有大爱精神，实现自我价值，同时体现社会价值。     @团队招募：寻找志同道合的各行各业精英同仁们，和我一起组建团队吧，交个朋友，一起轻创业，携手相互学习，共同进步，帮助他人同时成就自我，成为一名具有大爱的保险企业家！       不管你是否决定要来，只要对这个行业、或者这个公司感兴趣，只要你还想了解其他行业，都希望你可以给我们机会认识彼此，只要你来交流，一定会让你不虚此行！,理财顾问<$&0007&$>保险企业家<$&0007&$>养老管家<$&0007&$>家庭医生<$&0007&$>培训讲师<$&0007&$>销售<$&0007&$>贷款<$&0007&$>投资<$&0007&$>存储<$&0007&$>业务骨干,1.5-3万,大专,成都市,2023-08-24 00:00:00
296,新特能源股份有限公司,新特能源股份有限公司,研发工程师（乌鲁木齐） (职位编号：1),<$&0006&$><$&0007&$>    <$&0006&$><$&0007&$>        工作职责：1.收集、整理国内外同行多晶硅生产的相关技术信息、技术发展方向及国内外优势科研研究，跟踪研究最新工艺技术，撰写相关研究分析及应用分析报告；4.与国内外行业及专家协会保持良好关系，参加各项研发学术会议，提升企业技术研发整体水平；2.参与公司新产品、新技术、新工艺项目申请、研发，提出可行性方案，确保项目进度及质量，进行新产品、新技术、新工艺推广应用；3.为多晶硅生产提供技术支持，参加设备、工艺、技术改造及革新以降低能耗、提高质量、改善环境； 任职资格：1、硕士及以上学历；2、化工、化学工艺、材料科学与工程相关专业；3、良好的学习能力及沟通表达能力，执行力强，责任心强。 ,,1-1.5万,硕士,乌鲁木齐市,2022-04-01 00:00:00
297,中国平安财产保险股份有限公司番禺支公司,中国平安财产保险股份有限公司番禺支公司,大客户业务部客户经理,<$&0006&$><$&0007&$>    <$&0006&$><$&0007&$>        1、从事政府、企业等团体渠道或客户的业务拓展、维护、等销售支持、推动工作；2、协助团队经理参与具体的线上化业务拓展、推动；3、按照标准作业模式，做好客户售前、售中及售后服务；4、相关理赔服务跟进;5、其他常规工作。1、本科及以上学历，保险专业尤佳；2、具有良好的沟通协调能力、抗压能力；3、具备较强的执行力、业务拓展能力、推广能力；4、掌握一定保险产品知识，对保险行业有较强认同感；5、各类办公软件操作熟练掌握、学习能力强、细心耐心。,,5千-1万,本科,广州市,2023-08-16 00:00:00
298,中关村科技租赁股份有限公司,中关村科技租赁股份有限公司,高级战略经理,<$&0006&$><$&0007&$>    <$&0006&$><$&0007&$>        1、制定和完善公司战略管理、投资管理等相关制度和流程；2、研究分析宏观环境及竞争对手动态，拟定公司战略目标与战略规划；3、根据公司战略规划，协助制定公司年度经营指标与运营规划；4、协助公司领导对公司年度经营指标进行分解，设计分子公司绩效考核指标；5、参与战略投资工作，撰写可研报告，协助开展并购、股权投资等战略运营管理；6、负责公司重要文稿的撰写工作。任职要求：1、金融学、经济学、财务管理等相关专业硕士及以上学历；2、5年及以上大型金融企业、集团企业、上市公司战略规划岗、投资管理岗等相关工作经验；3、具有战略规划、投资管理、产业经济学等相关专业知识，具有较强的分析思考能力；4、具有出色的文案写作能力，能够独立完成公司级重要文案撰写；5、英文读写熟练，沟通能力较强，抗压能力强。,战略规划,2-4万/月,硕士,海淀区,2020-03-18 00:00:00
299,江阴华新精密科技股份有限公司,江阴华新精密科技股份有限公司,HRBP主管,<$&0006&$><$&0007&$>    <$&0006&$><$&0007&$>        岗位职责：1、制定年度招聘计划，协助各部门梳理招聘需求，结合招聘人员类型制定招聘策略，落实招聘计划；2、负责公司核心人才梯队建设与干部管理，深挖工艺、技术部门人力资源选、育、留痛点，定期对各部门进行人才盘点和人效分析，组织人才选拔及培养；3、依据各关键岗位的任职要求与人员素质特点，编制公司层面关键岗位职业发展通道，形成岗位序列与职级体系；4、基于业务部门目标落地，剖析HR相应策略，为组织发展提供人力资源支持，在人员招聘、组织发展、组织文化、员工关系（关怀）、绩效激励等方面提供有效解决方案并实施；5、基于业务目标与人才发展规划，为生产、技术人员合理化配置（无冗余人员）提供诊断建议，综合运用外部招聘与内部人才培养，确保关键岗位人才的准备度与满足度；6、通过讲故事、做引导传播公司文化，辅助业务部门管理者开展团队建设，提高团队凝聚力，不断提升团队工作效能，并针对执行结果进行有效反馈和改进；7、深入了解公司的业务流程和业务模式，包括熟悉产品核心价值和核心业务流程，理解客户的需求以及了解市场趋势，能从更广阔的视角出发发掘业务问题，并协助业务领导规划解决方案，有效地帮助并推动业务的前进。8、完成领导交办的其他事项。任职资格：学历：本科及以上学历，38岁以下，专业不限，熟悉工业工程与精益生产改善者优先；经验：二年以上规模型制造业HRBP工作经验、人力资源招聘、绩效、培训、薪酬等岗位经验；技能：EXCEL函数使用能力，BSC应用能力、岗位技能矩阵构建能力、招聘测评工具使用能力、人才盘点实施能力。素质：具备较强的团队协作能力，良好的沟通能力以及人际关系处理能力。备注：不完全具备上述能力，但对上述工作有较强意愿的本科学历，2年以上招聘、绩效等相关工作接受定项培养的也可。工作地点：江阴市顾山镇,劳动关系<$&0007&$>绩效管理<$&0007&$>HRBP<$&0007&$>招聘与配置<$&0007&$>薪酬福利<$&0007&$>培训<$&0007&$>人力资源<$&0007&$>团队建设<$&0007&$>人员招聘<$&0007&$>员工关系<$&0007&$>招聘计划<$&0007&$>hr<$&0007&$>工业工程<$&0007&$>人才盘点<$&0007&$>人才培养,7千-1.4万·14薪,本科,无锡市,2024-01-23 00:00:00
300,上海矩子科技股份有限公司,上海矩子科技股份有限公司,财务助理,<$&0006&$><$&0007&$><$&0005&$><$&0005&$><$&0005&$><$&0005&$><$&0005&$><$&0005&$>1. 大三或大四在校学生，财务会计类相关专业，良好的沟通能力，实习期3个月；2. 协助经理完成日常事务性财务工作 ；3. 协助财会文件的准备、归档和保管 ；4. 特别熟悉office软件及财务软件应用优先 ；5. 诚实可靠，责任感强，性格稳重，良好的职业操守及团队合作精神，较强的沟通、理解和分析能力，具有独立工   作和学习的能力，工作认真细致；6. 实习生简历请投至 master@jutze.com.cn 企业邮箱，我们会择优录取。 ,,,本科,闵行区,2016-11-01 00:00:00
301,深圳市赢时胜信息技术股份有限公司,深圳市赢时胜信息技术股份有限公司,实施工程师-金融 (MJ001097),<$&0006&$><$&0007&$>    <$&0006&$><$&0007&$>        工作内容1、配合项目经理/高级实施人员在客户现场进行系统实施上线；2、配合项目经理/高级实施人员在客户现场进行系统测试；3、独立在客户现场进行系统环境搭建以及安装；4、独立在客户现场完成日常维护工作。职位要求：1、本科及以上学历，计算机相关专业；2、1年以上软件实施工作经验；3、熟悉EJB、servlet，熟悉spring、struts、hibernate等开源框架；4、熟练使用Oracle，能使用SQLServer/DB2等数据库者优先，能熟练编写SQL、存储过程、用户自定义函数、视图、触发器；5、熟悉weblogic、tomcat、websphere等应用服务器，熟悉windows系统上的安装部署和配置；熟悉UNIX系统上的安装部署者优先；6、活泼外向，具有较强的沟通能力和团队协作精神。有较强的抗压能力；7、有证券从业资格证/基金从业资格证书者尤佳。,,0.9-1.5万/月,本科,浦东新区,2021-10-27 00:00:00
302,中国平安人寿保险股份有限公司广东分公司,中国平安人寿保险股份有限公司广东分公司,渠道推动岗,<$&0006&$><$&0007&$>    <$&0006&$><$&0007&$>        岗位要求：1、全日制本科及以上学历；2、专业不限，综合能力强、工作有激情；3、有较强的沟通能力、创新能力、分析能力。工作职责：1、按照本机构渠道业务节奏，统筹渠道相关销售政策、销售方案；2、根据渠道发展要求，对渠道年度、月度销售计划进行追踪；3、制定对渠道的业务推动举措并推动实施。,,8千-1.2万,本科,广州市,2023-08-17 00:00:00
303,周大生珠宝股份有限公司,周大生珠宝股份有限公司,直营业务管理,<$&0006&$><$&0007&$><$&0005&$><$&0005&$><$&0005&$><$&0005&$><$&0005&$><$&0005&$>工作职责：1，了解市场动态，依据市场变化适时策划制定促销方案，策划定期的促销活动；2，有良好的沟通能力和亲和力，能有效的与商场，门店之间协调工作；3，负责门店日常运营工作，督导门店相关事宜。,,,中专,青岛市,2016-09-27 00:00:00
304,苏州江天包装科技股份有限公司,苏州江天包装科技股份有限公司,行政专员,"<$&0006&$><$&0007&$>    <$&0006&$><$&0007&$>        1.有行政工作经验优先。2.公司行政工作管理                                                          3.员工安全、消防等协调管理工作。                                                                      4.公司日常行政安排、行政物资采购等5.良好的谈吐气质、沟通能力、亲和能力。6.熟悉企业文化构建、后勤服务。上班时间：8点到17:30,一周***一周双休五险当月生效，一金满3个月缴",行政专员,4.5-6千/月,大专,苏州市,2022-04-13 00:00:00
305,阜新德尔汽车部件股份有限公司,阜新德尔汽车部件股份有限公司,销售内勤,<$&0006&$><$&0007&$><$&0005&$><$&0005&$><$&0005&$><$&0005&$><$&0005&$><$&0005&$>岗位职责：主要根据市场业务方面的信息，传递、下达生产完成任务，同时协调并跟踪完成情况。任职要求：大专学历，6年以上相关工作经验,,,大专,阜新市,2016-06-17 00:00:00
306,中国平安人寿保险股份有限公司天津分公司,中国平安人寿保险股份有限公司天津分公司,售后服务岗,<$&0006&$><$&0007&$>    <$&0006&$><$&0007&$>        帮助保险客户进行续期服务及保单检视等1、需经专业培训后，了解客户所购买保险用途及保险责任；2、及时并精准提醒客户完成保单检视及客户信息维护；3、及时发现客户保障缺口并做到无缝提醒；4、专业且贴近客户需求的提供建设性建议，完成客户保障；5、帮助客户做理赔服务；,理赔服务<$&0007&$>续期服务<$&0007&$>保单检视<$&0007&$>客户信息维护<$&0007&$>保险责任,6千-1.2万,中技,静海区,2023-07-26 00:00:00
307,中国平安人寿保险股份有限公司广东分公司朝阳营销服务部,中国平安人寿保险股份有限公司广东分公司朝阳营销服务部,经理助理,<$&0006&$><$&0007&$>    <$&0006&$><$&0007&$>        【基本条件】1、年龄：25-45周岁2、学历：大专（含）以上学历，3、品貌端正，身体健康4、无不良嗜好，无违法犯罪记录5、有一定的应变能力6、AI面试合格【专业培训】岗前带薪培训，上岗后团队协作，老带新入行【收入待遇】参考并高于本市一般白领工资待遇【上班时间】工作日8:30-5:30，周末双休不加班。【职业规划】公司提供的晋升通道不用走关系，无须背景，不论年资，公平公正公开晋升。【福利保障】根据不同职级提供涵盖意外伤害、意外医疗、住院医疗、养老公积金、身故等多项大额保险保障欢迎投递简历详细咨询。,销售<$&0007&$>业务<$&0007&$>销售代表<$&0007&$>跟单<$&0007&$>业务主管<$&0007&$>促销<$&0007&$>文员<$&0007&$>助理<$&0007&$>行政<$&0007&$>人事,6-8千,大专,广州市,2023-08-16 00:00:00
308,大连万科物业服务有限公司,大连万科物业服务有限公司,市场拓展专员,<$&0006&$><$&0007&$>    <$&0006&$><$&0007&$>        岗位职责：1. 负责研究市场动态，项目信息的收集、整理、分析，为公司开拓市场化提供决策依据。 2. 负责对外承接业务项目，独立开拓、拜访客户，统筹完成物业、施工单位等项目接待、组织、洽谈、合同评审及签订工作。 3. 掌握了解客户需求，积极发展新客户，建立并维护良好的合作关系，拓展合作资源。 4. 现有项目的运营维护，及时跟进和沟通，保持良好的客情关系。 5. 部门领导临时交办的其他任务。任职要求：1. 本科以上学历，专业不限，形象气质良好 2. 具有物业、房地产、工程施工、工程材料等相关行业市场拓展3年以上工作经验 3. 工作认真踏实，具有较强的协调能力和团队协作意识，有责任心 4. 具有优秀的谈判能力及出色的市场开拓能力，有资源者优先 5. 能适应阶段性出差6.  以往工作业绩良好，自我管理能力强，具备优秀的抗压能力、情绪管理能力。7.  认同公司企业文化、发展战略。,,5-6千,本科,大连市,2023-03-28 00:00:00
309,福建睿能科技股份有限公司,福建睿能科技股份有限公司,结构工程师,<$&0006&$><$&0007&$>    <$&0006&$><$&0007&$>        1、负责产品整机外观、结构及零部件的设计；绘制3D图及2D零件规格书；2、负责结构件打样，指导样机制作，提供修改方案和结构件的最终确认。3、负责项目结构件客户端反馈问题沟通、处理，相关结构的的设计、修改等；4、负责项目结构BOM建立、审核、维护；5、负责产品装配工艺制订，解决负责项目生产过程相关结构件问题处理；6、负责拟制结构件设计变更通知，对更改的可行性进行评估，跟踪处理。1、***本科以上；机械设计、制造类、模具等相关专业；2、产品结构设计相关工作5年以上；3、熟悉产品外观设计、结构设计；有结构散热设计经验；4、熟悉五金、塑胶模具等结构件生产工艺；5、能熟练运用AUTOCAD，CREO等专业软件。,模具<$&0007&$>塑胶<$&0007&$>钣金,0.7-1.4万/月,本科,福州市,2022-05-16 00:00:00
