id,公司名称,关联公司名称,岗位,岗位描述,岗位标签,待遇,学历,所在城市,发布时间
1,中国平安人寿保险股份有限公司广东分公司,中国平安人寿保险股份有限公司广东分公司,兴业银行渠道经理,<$&0006&$><$&0007&$>    <$&0006&$><$&0007&$>        因业务开拓，需招聘一批兴业银行保险渠道经理。对接兴业银行广州地区各个网点。新赛道、新机遇，用努力，让梦想发光！欢迎大家积极举荐！一经录用，公司将提供广阔的发展平台及福利待遇！（一）岗位职责1、银行渠道的维护，日常经营，相关培训辅导等；2、与银行支行或网点一同策划及组织市场活动、客户经营；3、达成公司考核指标及业绩要求，相关售前中后支持及服务工作；（二）平台优势1、广阔市场前景：客户投资需求趋向于长期稳健；2、强大公司实力：世界500强注重长期发展，全面系统的培训；3、优质客户资源：与银行强强联合科学资产配置；4、优厚薪酬机制：相对固薪+绩效提成+达标奖+方案奖+季度奖+年终奖，7大福利（节日问候津贴、生日津贴、降温取暖补贴，社保福利补贴等）和综合福利保障（二）任职要求1、本科及以上学历2、年龄在25-45周岁之间（有潜力、擅沟通本科及以上人才可放宽至21周岁）3、语言表达能力较好，具备较强的协调、公关、分析问题、解决问题的能力，有同业、销售管理、金融行业、银行从业经验的绩优人员优先4、具备一定的直接销售技能或潜力,销售<$&0007&$>银行<$&0007&$>金融行业<$&0007&$>公关<$&0007&$>市场活动<$&0007&$>客户经营<$&0007&$>培训辅导<$&0007&$>银行渠道维护<$&0007&$>保险渠道<$&0007&$>考核,1-2万,本科,广州市,2023-10-30 00:00:00
2,上海璞泰来新能源科技股份有限公司,上海璞泰来新能源科技股份有限公司,研发工程师,<$&0006&$><$&0007&$><$&0005&$><$&0005&$><$&0005&$><$&0005&$><$&0005&$><$&0005&$>1.金属材料工程、高分子材料与工程、材料成型及控制等相关专业，本科以上学历，两年以上技术工作经验优先；   录取；2.在多层复合材料、化学钝化，表面处理，等领域具有工作经验者优先；3.具有良好的文字组织能力，能够熟练编写项目报告；4.负责产品的技术开发、项目管理及技术支持； 5.工作认真负责，严谨细致，有良好的创业精神和团队精神；身体健康，能适应出差和加班。  ,,,本科,东莞市,2016-11-28 00:00:00
3,嘉亨家化股份有限公司,嘉亨家化股份有限公司,水电工程师,<$&0006&$><$&0007&$>    <$&0006&$><$&0007&$>          1、按照公司要求安装发电机组； 2、根据公司反映的发电机组状况及时诊断出发电机组故障并排除。     3、需持有高压、低压电工资格操作证书；4、需有三到五年工业配电操作相关工作经验；5、熟悉电动机及其它机电设备控制电路；6、熟悉工厂水电安装维修维护工作；7、有组织协调能力者优先；,电工证,4-6千/月,中技,泉州市,2020-06-23 00:00:00
4,中国平安人寿保险股份有限公司成都市金堂支公司淮口营销服务部,中国平安人寿保险股份有限公司成都市金堂支公司淮口营销服务部,金融销售培训讲师+周末双休,<$&0006&$><$&0007&$>    <$&0006&$><$&0007&$>        岗位职责:1.负责公司，新人入司培训。2.完成课程安排。3.负责公司产品销售培训。4.能按时完成公司领导交代的任务。岗位要求:1.年龄:25岁-45岁2.学历:大专以及大专以上学历（有相关工作经验优先）3.工作认真，要有责任心.上进心.晋升机制：实习综合金融专员-正式综合金融专员-见习综合金融导师-初级综合金融导师-中级综合金融导师-高级综合金融导师-精英综合金融导师薪资及福利待遇:1.底薪+新人学习津贴+全勤+高额提成+课时费+季度奖+年终奖+达成奖励2.公司每年有旅游方案，完成任务就可以免费去旅游。3.公司每个季度会挑选优秀的员工去参加公司的导师培训学习。,产品培训<$&0007&$>入司培训<$&0007&$>课程安排<$&0007&$>销售<$&0007&$>管理<$&0007&$>培训<$&0007&$>导师,10-15万/年,大专,成都市,2023-03-27 00:00:00
5,成都天箭科技股份有限公司,成都天箭科技股份有限公司,FPGA开发工程师,"<$&0006&$><$&0007&$>    <$&0006&$><$&0007&$>        岗位职责 1. 负责项目和产品的FPGA逻辑开发及软硬件联调工作；2. 负责项目和产品FPGA逻辑架构的设计工作，在原有FPGA代码基础上修改或重新编写控制软件无线电（SDR）芯片的部分代码； 3. 提出解决方案和组织算法研发工作的实施策略； 4. 负责项目和产品与逻辑相关的驱动流程文档的编写工作； 5. 负责FPGA配套的上位机的软件编写，同软、硬件设计人员一起完成项目。 任职要求： 1. 电子类相关专业在职研究生；2. 熟练掌握Verilog/VHDL, FPGA时序优化、资源优化方法； 3. 熟练使用Quartus II，Modelism等软件； 4. 熟悉Transceiver等高速接口，***有SDR（软件无线电）专业基础； 5. 从事过FPGA项目开发，特别对lime-SDR有一定了解。可转正、可提供实习证明。",芯片<$&0007&$>xilinx<$&0007&$>vhdl,4-7千,硕士,成都市,2022-07-10 00:00:00
6,北京耐威科技股份有限公司,北京耐威科技股份有限公司,软件工程师,描述：1、<$&0005&$>负责部门现有导航软件的维护及升级；2、<$&0005&$>参与卫星导航及惯性导航类应用软件的开发；3、<$&0005&$>参与部门软件项目的开发；4、<$&0005&$>完成开发软件中的各类文档的撰写；要求：1、<$&0005&$>计算机及相关专业专科以上学历，一年以上工作经验；2、<$&0005&$>熟悉VC开发环境，能够使用MFC进行开发工作；3、<$&0005&$>熟悉Windows API接口函数和Windows消息机制，能够使用外部类进行开发；4、<$&0005&$>工作认真敬业，能够适应团队开发工作；5、<$&0005&$>熟悉卫星导航或惯性导航相关知识的优先；6、<$&0005&$>参与过大型项目开发的优先；<$&0005&$><$&0005&$><$&0005&$><$&0005&$><$&0005&$><$&0005&$><$&0005&$><$&0005&$><$&0005&$><$&0005&$><$&0005&$><$&0005&$><$&0005&$><$&0005&$><$&0005&$>上班地址：北京市西城区<$&0005&$><$&0005&$><$&0005&$><$&0005&$><$&0005&$><$&0005&$><$&0005&$><$&0005&$><$&0005&$>,,面议,大专,西城区,2015-05-22 00:00:00
7,上海万科物业服务有限公司,上海万科物业服务有限公司,住宅物业项目经理,<$&0006&$><$&0007&$>    <$&0006&$><$&0007&$>        一、岗位职责1.履行《物业服务合同》规定的相关义务，维护小区环境、秩序、公共设施设备完好。2.根据公司质量方针和目标，贯彻ISO9000质量体系。3.负责小区物业费的收缴工作，充分调动各岗位人员以提高物业费收缴率。4.根据公司绩效考核制度，按时完成对本小区人员的绩效考核。5.加强小区装修管理，确保装修有序进行。6.负责本服务中心年度及月度财务收支预算和控制。7.组织开展各项节能减耗措施，通过减少各方面的开销实现成本控制。8.开展各种经营活动，丰富盈利渠道，增加小区收入。9.及时妥善处理各类投诉，处理好与业主（使用人）的关系。10.定期对小区业主和住户发放意见征询表，统计、分析、处理和回访。11.维护与房管局、街道、社区、派出所、业主委员会等相关部门的关系。12.定期组织各类社区活动，丰富业主的业余生活。13.加强与公司各职能部门的沟通、协调，做好相关工作。14.负责团队建设，制定团队建设计划，组织开展各项团队活动。15.完成领导安排的其他工作。二、任职要求1、物业管理相关专业。2、有物业管理工作经验。3、具有良好的沟通、协调、组织、应变等综合能力，能承受较大工作压力。4、具有较强的团队管理能力，有业委会组建、物业费提价经验优先考虑。5、具有较强的服务意识，责任心强。,物业管理<$&0007&$>成本控制<$&0007&$>团队管理<$&0007&$>团队建设<$&0007&$>物业服务<$&0007&$>物业费收缴<$&0007&$>物业费收缴率<$&0007&$>经营<$&0007&$>财务收支预算<$&0007&$>团队活动,1-1.3万·14薪,本科,,2023-10-10 00:00:00
8,光大证券股份有限公司,光大证券股份有限公司,市场风险量化评估岗（权益类证券及衍生品）,<$&0006&$><$&0007&$><$&0005&$><$&0005&$><$&0005&$><$&0005&$><$&0005&$><$&0005&$>岗位职责：对权益类证券及其衍生品投资组合进行量化评估，包括设计量化/估值模型、盯市评估、系统实现、回测检验、压力测试、策略评估、编制量化报告等工作。任职要求：1、金融工程、数学、统计学、金融学、计量经济学硕士且在有关领域3年以上工作经历；2、熟练掌握权益类证券及衍生品的在险值计算模型、模型局限、回测方法，能够独立进行投资组合的在险值计算及定期回测；熟悉期权、期货、结构性产品的定价、风险度量模型、希腊字母的应用方法；了解期权产品的品种，交易策略，能够用对期权产品进行独立定价，并且计算希腊字母；3、能够使用MATLAB或其他数学和统计软件；4、有FRM、CFA资格或相关工作经验者优先。,,,硕士,静安区,2016-04-05 00:00:00
9,广西天山电子股份有限公司,广西天山电子股份有限公司,销售助理（韩语）,1、订单操作：销售订单ERP录入，变更管理，发货安排，物流对接。2、订单交付：异常交付发生时，及时处理或无法处理时上报处理。3、库存控制：控制负责版块库存更新及异常库存处理。4、应收应付：对账开票及跟催应收款，控制呆账；安排对外支付费用申请。5、销售计划跟进：跟催接单情况，分析负责的客户达成情况。任职要求：1.全日制大专以上学历，专业不限，具有较好的韩语水平和口语能力优先；2.熟练使用office办公软件；3.具有良好的沟通协调能力，反应灵敏，有一定的抗压能力；工作积极主动，有责任心，具有团队合作精神,应收应付异常库存处理韩语库存控制变更管理订单交付对账开票订单操作发货安排erp录入,7千-1万·13薪,大专,深圳市,2025-03-19
10,苏州道森钻采设备股份有限公司,苏州道森钻采设备股份有限公司,质量工程师,<$&0006&$><$&0007&$>    <$&0006&$><$&0007&$>        1. 协助体系工程师维护工厂质量体系；2.日常质量数据收集及分析；3.NCR调查分析及整改跟进；4. 协助设计工程师编制设计软件包；5.负责车间技术交底；6.其他质量、技术相关工作,,13-20万/月,本科,苏州市,2019-05-09 00:00:00
11,贵州燃气集团股份有限公司,贵州燃气集团股份有限公司,(GRJQ-242302)现场代表,"<$&0006&$><$&0007&$>    <$&0006&$><$&0007&$>        岗位类别：专业技术岗学历学位要求：大学本科及以上专业要求：工程造价、安全工程、新能源科学与工程、材料科学与工程、油气储运工程、土木工程、电气工程及其自动化等专业职业资格要求：1.40周岁及以下,持C1驾驶证；2.具有一定的工作经验，有良好的计划、组织、沟通、解决问题的能力，熟练使用CAD及常用办公软件，品行端正，能吃苦、无犯罪记录，服从公司安排；3.持相关中级职称或二级建造师证书。                                    招聘人数：1人工作地点：贵州遵义市招聘方式：社会招聘",,,本科,遵义市,2024-11-20 00:00:00
12,中国平安财产保险股份有限公司广东分公司,中国平安财产保险股份有限公司广东分公司,营销支持专员,<$&0006&$><$&0007&$>    <$&0006&$><$&0007&$>        工作内容：<$&0005&$>1、对现有合作渠道提供运营服务，包括批改批退、报错处理、系统测试、融通沟通等                                                         2、成本日常管理、双安费用结算、报销工作等                                                             3、前端咨诉件协同处理、消费者权益保护工作4、协议签订、归档管理5、内部项目推动等领导交代的其他工作      任职要求：  1、本科及以上，经验不限2、基础数据分析能力3、善于沟通，耐心、细心，爱学习可发送简历至lilijuan006@pingan.com.cn,,5-8千・16薪,本科,广州市,2023-03-15 00:00:00
13,江苏远航精密合金科技股份有限公司,江苏远航精密合金科技股份有限公司,融资会计/主办会计,<$&0006&$><$&0007&$><$&0005&$><$&0005&$><$&0005&$><$&0005&$><$&0005&$><$&0005&$>男女不限，28-38岁，财务专业或有关类似工作岗位经验，主要负责银行融资板块的转贷相关工作及公司资金的统筹调配。任职资格：1、有扎实的财务基础知识；2、熟悉银行信贷业务；3、有较强的协调沟通能力；4、有上进心、责任心，有一定的抗压能力；5、有良好的思想品德素养；6、服从公司统一安排。,,,,无锡市,2017-01-21 00:00:00
14,江苏常青树新材料科技股份有限公司,江苏常青树新材料科技股份有限公司,行政内勤,<$&0006&$><$&0007&$>    <$&0006&$><$&0007&$>        岗位职责：1、 配合行政经理做好各项行政管理工作；2、做好日常接待工作；3、具备较强的文案功底，能熟练起草、拟核、编写各类办公文件、材料，负责日常会务工作，做好办公会、专题工作会等会议记录、会议纪要的整理、归档； 岗位要求：1、大专及以上学历，待人接物有礼有节，做事细致，责任心强，有担当；2、悉行政、办公室管理相关工作流程，良好的沟通、协调和组织能力；3、熟练使用各类办公软件。,,3-4.5千/月,大专,镇江市,2022-02-27 00:00:00
15,中国平安人寿保险股份有限公司湖南分公司,中国平安人寿保险股份有限公司湖南分公司,保单售后整理,<$&0006&$><$&0007&$>    <$&0006&$><$&0007&$>        1、热爱工作，心态积极向上，有一定的学习能力。岗位职责：2、根据销售部提供的信息，为客户提供产品支持和解决方案。,,6千-1万,中技,长沙市,2023-06-15 00:00:00
16,中国平安财产保险股份有限公司中山中心支公司,中国平安财产保险股份有限公司中山中心支公司,客服理赔部现场作业岗（农）,<$&0006&$><$&0007&$>    <$&0006&$><$&0007&$>        （一）岗位要求：1、农、林、牧、渔相关专业，***本科以上学历；2、一年（含）以上的畜牧、农技工作经验优先考虑；3、具备较强的沟通能力、逻辑分析能力、落地执行能力、责任心强；4、熟悉农情，有C1驾照，能吃苦耐劳，抗压能力较强。（二）工作职责：1、协助客户处理事故的全流程理赔指引，指导客户填写及收集索赔资料；2、解答客户理赔咨询问题，为客户提供优质的理赔服务；3、负责完成公司内部的理赔全流程工作；4、风险案件现场走访调查；5、执行公司理赔政策及服从领导工作安排。（三）福利：1、现金福利：节日费、取暖/降温费2、补充保险：员工综合保障计划、高端医疗保障计划、企业年金计划3、假期福利：年休假、特殊奖励假、特殊岗位考试假、妇女节、青年节、义务献血假、婚假、产假、哺乳假等4、工会福利：每月定期组织篮球、羽毛球等俱乐部活动5、激励：实物奖励、旅游激励,农险专业<$&0007&$>保险,6千-1.2万,本科,中山市,2023-03-20 00:00:00
17,江苏晟楠电子科技股份有限公司,江苏晟楠电子科技股份有限公司,质量检验员,<$&0006&$><$&0007&$>    <$&0006&$><$&0007&$>        职责一、协助质量管理部部长制定公司年度质量计划，并负责实施；职责二、负责整理质量记录、质量信息；职责三、准确向质量管理部部长和相关部门传递有关质量检验信息；职责四、负责对产品交货前的原材料、半成品或成品质量检验；职责五、参与对新、老供应商的评价；职责六、参与现场标识状态管理；职责七、参与建立产品质量管理档案，参与产品质量改进分析；职责八、部门负责人交办的其他工作任务；,qc<$&0007&$>质检<$&0007&$>质量<$&0007&$>质检员,4.5-6千/月,大专,泰州市,2021-11-08 00:00:00
18,广东豪美新材股份有限公司,广东豪美新材股份有限公司,策略招聘（招聘经理）,<$&0006&$><$&0007&$>    <$&0006&$><$&0007&$>        1、根据集团公司招聘计划，开展招聘工作，与各部门保持密切沟通，在规定时间内完成招聘任务；2、根据公司整体招聘规划，制定招聘渠道的方案计划并组织实施、后期跟踪，负责公司中高端岗位招聘；3、开拓、建设和维护校企关系，推动校园招聘的各项工作实施；4、建立人才储备机制，储备公司发展需要人才。岗位要求：1、大专或以上学历，专业不限，猎头可优先考虑；2、具5年以上生产制造型企业职员招聘工作经验，擅长中高端人才招聘工作；3、沟通表达能力良好，计划性强，团队合作意识强，成就导向。,招聘<$&0007&$>猎头<$&0007&$>岗位招聘<$&0007&$>招聘规划<$&0007&$>校园招聘,1-1.5万,大专,清远市,2023-09-26 00:00:00
19,广东豪美新材股份有限公司,广东豪美新材股份有限公司,策略招聘（招聘经理）,<$&0006&$><$&0007&$>    <$&0006&$><$&0007&$>        1、根据集团公司招聘计划，开展招聘工作，与各部门保持密切沟通，在规定时间内完成招聘任务；2、根据公司整体招聘规划，制定招聘渠道的方案计划并组织实施、后期跟踪，负责公司中高端岗位招聘；3、开拓、建设和维护校企关系，推动校园招聘的各项工作实施；4、建立人才储备机制，储备公司发展需要人才。岗位要求：1、大专或以上学历，专业不限，猎头可优先考虑；2、具5年以上生产制造型企业职员招聘工作经验，擅长中高端人才招聘工作；3、沟通表达能力良好，计划性强，团队合作意识强，成就导向。,招聘<$&0007&$>猎头<$&0007&$>岗位招聘<$&0007&$>招聘规划<$&0007&$>校园招聘,1-1.5万,大专,清远市,2023-09-26 00:00:00
20,江苏龙蟠科技股份有限公司,江苏龙蟠科技股份有限公司,摩油销售-南区,<$&0006&$><$&0007&$>    <$&0006&$><$&0007&$>        岗位职责：1.开发并维护经销商渠道，协助、组织、培训区域内经销商开拓市场；2.向南区各级客户传达销售政策，并参与、指导、监督其执行；3.负责区域内竞品等市场信息收集上报、品牌基础建设工作。任职资格：1.本科学历，市场营销、工商管理等专业优先；2.具备3年以上销售经验，接受出差，摩配行业优先；3.熟悉渠道管理模式和掌握基础的市场营销知识。,渠道销售,0.5-1万/月,本科,南京市,2021-09-16 00:00:00
21,烟台睿创微纳技术股份有限公司,烟台睿创微纳技术股份有限公司,资深技术员（倒班）,岗位职责：1.负责半导体晶圆生产工作，包括光刻，薄膜，刻蚀，湿法等步骤。2.支持产线生产，满足产出要求，保障产品质量，做好洁净室的6S等。3.协助研发部门完成相关工作。任职要求：1.大专及以上学历，电子类专业。2.有半导体晶圆厂工作经验，熟悉上述任一模组者优先。3.工作态度端正，认真细致。4.能接受倒班。,电子刻蚀产品质量薄膜湿法产线生产光刻,7千-1.1万,大专,无锡市,2025-05-22
22,广东温氏食品集团股份有限公司,广东温氏食品集团股份有限公司,财务会计,<$&0006&$><$&0007&$><$&0005&$><$&0005&$><$&0005&$><$&0005&$><$&0005&$><$&0006&$><$&0007&$><$&0005&$><$&0005&$><$&0005&$><$&0005&$><$&0005&$><$&0005&$>岗位职责 1、协助财务主任完成预算、审核、监督工作，按照公司及政府有关部门要求及时编制各种财务报表并报送相关部门； 2、负责员工报销费用的审核、凭证的编制和登帐； 3、对已审核的原始凭证及时填制记帐； 4、准备、分析、核对税务相关问题； 5、审计合同、制作帐目表格。 任职资格 1、财务、会计专业本科以上学历，持有会计证； 2、有财务会计工作经历者优先； 3、熟悉会计报表的处理，会计法规和税法，熟练使用财务软件； 4、良好的学习能力、独立工作能力和财务分析能力； 5、工作细致，责任感强，良好的沟通能力、团队精神。薪酬福利： 1、本科毕业生首年年薪6-8万，另设总裁创新奖、管理创新奖、优秀员工等众多奖项，为优秀人才提供最具竞争力的待遇条件。 2、公司为员工提供五险+额外商业保险、带薪年假、法定节假日休假及节日慰问金、住房补贴、免费旅游等福利；,,6-10万/年,本科,朝阳市,2017-09-20 00:00:00
23,成都秦川物联网科技股份有限公司,成都秦川物联网科技股份有限公司,算法工程师,<$&0006&$><$&0007&$>    <$&0006&$><$&0007&$>        岗位职责：1、 热爱公司，服从上级领导安排，遵守公司的各项管理制度，自觉维护公司利益；2、 根据团队要求，独立规划并完成所承担的研发等相关任务；3、基于项目控制任务要求，独立完成相应控制算法设计、算法实现及设备调试工作；4、负责项目控制系统需求分析、控制系统详细设计、控制系统仿真分析、测试方案设计；5、负责项目运动控制系统及控制算法设计、分析、实现与测试；6、撰写相关技术文档，指导协调项目工程师完成工作，根据各职能工程师反馈结果更新设计；7、积极挖掘和撰写专利；8、积极完成上级领导安排的临时任务。任职条件：1、本科（含）以上学历，计算机、数学、电子等相关专业。3年以上精密运动产品研发或具有相关项目经验的优秀应届硕士毕业生；2、具有一定的C/C++/Python编程与算法实现能力，深入了解实时系统；3、掌握自动化控制，机电机械装备、电气系统及其工作原理，具有机电装备运行调试、自动控制编程与实现等经验；4、具有扎实的数学功底，思路清晰；有很强的探索欲望与学习能力；良好的语言以及文字表达能力，善于编写技术文档；5、有多接点控制系统研发经验优先，熟悉控制系统IO延迟及处理方法优先。工作地址：成都市龙泉驿区经开区南四路931号（导航车城西一路经开区职工之家500米）公司在 二号线地铁站 设定“定制巴士”，上下班接送；公司免费提供食宿；,算法<$&0007&$>C/C++<$&0007&$>Python编程,0.8-1.5万/月,本科,成都市,2021-01-06 00:00:00
24,广东驱动力生物科技股份有限公司,广东驱动力生物科技股份有限公司,功能食品销售+周末双休+六险一金,<$&0006&$><$&0007&$><$&0005&$><$&0005&$><$&0005&$><$&0005&$><$&0005&$><$&0006&$><$&0007&$><$&0005&$><$&0005&$><$&0005&$><$&0005&$><$&0005&$><$&0005&$>岗位职责：1、主要负责：高端补血鸡蛋的市场销售2、开发拓展功能性食品的市场渠道3、开发维护客户关系4、对订单的执行情况进行跟踪与反馈5、收集同行业市场信息，并及时反馈公司任职要求：1、专科以上学历，专业不限2、1年以上销售工作经验3、保健食品、功能食品、保险、房地产销售经验优先4、具备挑战市场高薪的勇气胆识，良好销售谈判技巧及沟通能力薪酬：底薪+费用+提成，年度综合薪酬9万起，上不封顶，相关产品管理经验者面议福利：周末双休六险一金通讯补贴生日礼金节日福利员工旅游定期体检股票期权,直销销售,8-10万/年,,广州市,2019-04-26 00:00:00
