id,公司名称,关联公司名称,岗位,岗位描述,岗位标签,待遇,学历,所在城市,发布时间
439,深圳冰川网络股份有限公司,深圳冰川网络股份有限公司,人力资源-设计实习生,<$&0006&$><$&0007&$>    <$&0006&$><$&0007&$>        【职位描述】1. 负责冰川网络官方公众号推文内容设计排版等工作；2. 负责校招物料的设计和制作，包括易拉宝，展架，海报，PPT等；3. 参与媒体媒体矩阵的运营，把控内容宣发的质量；【岗位要求】1. 在校大学生，23、24届更佳，能保证一周4-5天工作，可在线办公；2. 熟练使用PS、AI等设计软件，具备手绘能力；3. 有耐心，良好的沟通能力和多任务协调能力。【加分项】1.有运营个人自媒体账号经验；2.有插画或视频剪辑等相关技能；3.简历附上作品集。【你将获得】1. 一段优质实习经历，为简历加分；2. 有吸引力的实习薪资；3. 有爱的leader，与小伙伴们一起成长；4. 免费下午茶，节日礼物等各类隐藏福利等你探索。,品牌设计,150元/天,本科,深圳市,2021-10-27 00:00:00
440,山东亚华电子股份有限公司,山东亚华电子股份有限公司,硬件测试经理,"<$&0006&$><$&0007&$><$&0005&$><$&0005&$><$&0005&$><$&0005&$><$&0005&$><$&0006&$><$&0007&$><$&0005&$><$&0005&$><$&0005&$><$&0005&$><$&0005&$><$&0005&$>工作职责：1.负责硬件产品测试项目，跟进产品不同周期的品质、风险及进度；2.制定项目测试计划，带领测试团队开展项目测试工作，审核测试团队交付件，确保各阶段测试工作按时、保质完成；3.跟进用户、售后反馈；4.评估项目测试预算，在项目周期中进行成本控制；5.研究测试技术、流程、方法并应用到测试工作中，提升项目效率和质量。 任职要求：1.熟悉产品研发测试流程、测试解决方案、和测试质量管理体系，项目管理相关知识；2.熟悉缺陷管理流程、工具3.具有较强责任心，优秀的应急响应能力及独立解决问题的能力；4.良好的沟通协调能力，团队合作精神,，能承受较大工作压力 5.需具备归纳总结持续改进的能力6.3年以上硬件产品测试相关经验，2年以上测试项目管理经验。?",硬件测试<$&0006&$><$&0007&$><$&0005&$><$&0005&$><$&0005&$><$&0005&$><$&0005&$><$&0005&$><$&0005&$><$&0005&$><$&0005&$><$&0005&$><$&0005&$><$&0005&$><$&0005&$><$&0005&$><$&0005&$><$&0005&$><$&0005&$>测试项目管理<$&0006&$><$&0007&$><$&0005&$><$&0005&$><$&0005&$><$&0005&$><$&0005&$><$&0005&$><$&0005&$><$&0005&$><$&0005&$><$&0005&$><$&0005&$><$&0005&$><$&0005&$><$&0005&$><$&0005&$><$&0005&$><$&0005&$>研发测试流程,0.7-1万/月,本科,淄博市,2018-10-14 00:00:00
441,杰华特微电子股份有限公司,杰华特微电子股份有限公司,人事行政主管,<$&0006&$><$&0007&$>    <$&0006&$><$&0007&$>        岗位职责：1.负责深圳子公司人员招聘，尤其是校招的持续对接；2.负责员工关系，包括入离职手续办理、试用期跟进等；3.负责深圳当地政府部门对接，党团组织事务，及时了解当地政策动向，人才评定申报等；4.配合总部员工培训和企业文化建设，定期组织团建、生日会等活动；5.负责子公司人事行政事务的统筹管理，异常处理。任职要求：1.本科学历，管理类专业或理工科背景，3年以上深圳本地相关工作经验；2.熟悉招聘、员工关系模块，其他模块经验丰富者更佳，优秀者可谈；3.熟悉劳动人事法律法规和成都当地各项人事政策；4.较强的沟通协调和团队协作能力，责任心强。,人事<$&0007&$>人事主管<$&0007&$>招聘,0.7-1.2万/月,本科,深圳市,2021-12-15 00:00:00
442,中国平安财产保险股份有限公司福建分公司,中国平安财产保险股份有限公司福建分公司,23届橙星管培生（市场营销）,<$&0006&$><$&0007&$>    <$&0006&$><$&0007&$>        岗位职责：1.负责全省全渠道对应行业、专业版块的体系搭建、市场研究等业务营销支持服务工作； 2.负责全省全渠道对应行业、专业版块的商机促成和队伍线上化推动；3.各营销渠道基本法、考核、投保政策制定，投产效果、业绩及成本的监控、评估和问题反馈；4.根据公司要求，完成管培生培训、团建等相关考核工作。岗位要求：1.2023届国内外本科及以上学历毕业生，数统类、精算类、计算机类、新能源类、农学类等理工类相关专业优先；2.良好的沟通能力、协助能力、学习能力和专业水平；3.有知名企业实习经验者优先；4.根据个人专业及面试情况双选于职能条线相关岗位。,,6-8千・15薪,本科,福州市,2023-03-23 00:00:00
443,湖北开特汽车电子电器系统股份有限公司,湖北开特汽车电子电器系统股份有限公司,计划员,岗位职责：、客户订单的跟踪交付；2、客户系统订单的查看；3、三方仓库库存的监控等。岗位要求：1、大专以上学历；2、物流计划相关专业；3、熟悉ERP系统及常规办公软件的使用。,ERP,5-6.5千,大专,武汉市,2025-02-27
444,中国平安人寿保险股份有限公司江苏分公司南京第七营业部,中国平安人寿保险股份有限公司江苏分公司南京第七营业部,销售顾问,<$&0006&$><$&0007&$>    <$&0006&$><$&0007&$>        工作内容：职位主要职责包括：- 负责公司产品的销售；- 搜集客户信息，了解客户需求，提供专业的销售方案；- 完成销售合同，确保客户满意并确保合同执行；- 维护与客户的良好关系，提供优质的售后服务；- 参与销售项目的策划和执行，确保项目进度和结果；- 完成销售数据和业绩的汇报工作。职位要求：- 大专及以上学历，1年销售工作经验；- 熟悉销售技巧和销售策略，具备良好的销售能力；- 具备良好的沟通能力和团队合作意识，善于与客户建立良好的关系；- 具备良好的职业道德和职业操守，诚实守信，保密性强；- 熟练掌握常用办公软件，具备良好的数据处理能力。,,1-1.5万,大专,南京市,2023-10-19 00:00:00
445,哈尔滨威帝电子股份有限公司,哈尔滨威帝电子股份有限公司,大客车通勤司机,岗位职责：1、哈市户口，熟悉哈市交通及道路状况；2、持有国家认可的A级驾驶证；3、早晚大客车通勤驾驶工作；4、熟悉车辆基本养护及维修知识；5、服从公司领导的安排，有团队协作能力，诚实可靠。任职资格：1、年龄40-55之间，身材匀称，身体健康，视力良好，无不良嗜好；2、沟通能力好，性格随和，吃苦耐劳，能适应临时安排的加班任务；3、家住红博世纪广场附近优先；4、有货运资格证者优先。应聘联系电话：15331885560 董小姐<$&0005&$><$&0005&$><$&0005&$><$&0005&$><$&0005&$><$&0005&$><$&0005&$><$&0005&$><$&0005&$><$&0005&$><$&0005&$><$&0005&$><$&0005&$><$&0005&$><$&0005&$>上班地址：经开区哈平路集中区哈平西路11号<$&0005&$><$&0005&$><$&0005&$><$&0005&$><$&0005&$><$&0005&$><$&0005&$><$&0005&$><$&0005&$>,,,高中,哈尔滨市,2015-10-24 00:00:00
446,中国平安人寿保险股份有限公司宁波分公司,中国平安人寿保险股份有限公司宁波分公司,保险医养顾问,<$&0006&$><$&0007&$>    <$&0006&$><$&0007&$>        工作内容：负责为客户提供全面的保险医养服务，包括不限时间的健康咨询、医疗咨询、保险理赔等。主要职责：- 负责进行客户健康咨询，了解客户的身体状况，为客户制定合理的医疗计划；- 负责咨询、指导客户进行医疗服务，包括预约医生、住院指导等；- 负责协助客户办理医疗理赔，跟进理赔进度，确保客户能够顺利得到理赔；- 负责维护与客户的长期关系，关注客户健康状况，提供 那么就必须慎重考虑；- 负责公司医养服务的推广和宣传，提高公司的品牌形象。职位要求：- 大专及以上学历，医疗、保险或相关专业；- 5年以上保险医养顾问工作经验，具有丰富的客户服务经验和医疗资源；- 熟悉医疗、保险相关政策法规，具备一定的医疗知识和技能；- 具备良好的沟通能力和团队合作精神，能够独立工作和处理问题；- 具有敏锐的洞察力和责任心，能够保证客户的利益和公司的品牌形象。,有老客户资源<$&0007&$>双休<$&0007&$>时间弹性自由<$&0007&$>收入上不封顶<$&0007&$>公平透明晋升,6千-1万,大专,宁波市,2023-03-07 00:00:00
447,江苏正丹化学工业股份有限公司,江苏正丹化学工业股份有限公司,销售工程师,<$&0006&$><$&0007&$>    <$&0006&$><$&0007&$>        岗位职责1、开发客户，维持良好的客户合作关系；2、按计划，定期拜访客户，定期回访；3、负责参展和一切客户开发活动；4、负责和客户签订销售合同，督促合同正常履行，并催讨所欠应收账款；5、对客户在销售中碰到的问题及时积极的解决；6、熟悉公司产品和指标。任职资格1、本科以上学历，化工类相关专业；有化工行业销售工作经验，有客户资源优先；2、吃苦耐劳，责任心强，有较强学习能力和团队合作精神；3、具备较强的客户沟通能力和较高的商务处理能力；4、有较强的人际交往和谈判能力。,销售<$&0007&$>业务员<$&0007&$>内贸,6-8千,本科,镇江市,2018-06-05 00:00:00
448,荣信教育文化产业发展股份有限公司,荣信教育文化产业发展股份有限公司,新媒体运营专员,<$&0006&$><$&0007&$><$&0005&$><$&0005&$><$&0005&$><$&0005&$><$&0005&$><$&0006&$><$&0007&$><$&0005&$><$&0005&$><$&0005&$><$&0005&$><$&0005&$><$&0005&$>任职要求：1、1年以上文案策划经验，有微信运营推广工作经验优先；2、具有较强的写作能力、组织能力、执行能力及良好的鉴赏能力；3、文案策划能力强，有独立策划微信活动及成功案例和经验。岗位职责：1、负责微信公众号的运营和管理；2、推广手册文案及各活动文案的撰写；3、其它企划活动的跟进与协助。联系人：周小姐 18674864636 【有意者可致电咨询】,,4.5-7千/月,大专,长沙市,2017-09-05 00:00:00
449,广州安凯微电子股份有限公司,广州安凯微电子股份有限公司,算法研究员/工程师（通信算法 26届校招岗）,职位要求：1、硕士/博士学历，通信、电子信息相关专业；2、熟练掌握C/C++语言，了解嵌入式软件开发；3、有通信产品相关协议层研发经验；4、有蓝牙/WIFI协议栈开发经验者优先。,c++通信电子信息蓝牙通信产品,3-4万,博士,广州市,2025-09-12
450,北京兆易创新科技股份有限公司,北京兆易创新科技股份有限公司,嵌入式软件工程师 (职位编号：gigadevice000378),<$&0006&$><$&0007&$><$&0005&$><$&0005&$><$&0005&$><$&0005&$><$&0005&$><$&0005&$>岗位职责:1、基于ARM处理器的嵌入式软件开发；2、基于USB通讯的数据采集板卡设计和开发。 任职资格:1、电子工程、计算机相关专业，本科及以上学历，3年以上工作经验，精通C/C++ 软件开发；2、具有嵌入式软件、硬件底层驱动开发调试经验；4、具有基于ARM的嵌入式软、硬件系统的开发调试经验者优先；5、熟悉eMMC协议及原理优先；6、熟悉NAND原理优先；7、熟悉USB协议优先；8、有window/linux下应用程序开发经验优先；9、熟悉Python或脚本语言开发能力者优先；10、有独立分析、解决复杂问题的能力；工作积极、主动；11、善于与人交流、易于沟通，有良好的团队合作精神。,,,本科,海淀区,2016-05-21 00:00:00
451,浙江中科磁业股份有限公司,浙江中科磁业股份有限公司,采购专员,<$&0006&$><$&0007&$>    <$&0006&$><$&0007&$>        1.认真执行公司采购管理规定和实施细则，严格按采购计划采购公司原材料、辅料、五金、建材等以及安排设备采购和维修，做到及时、适用，合理降低物资积压和采购成本。对购进物品做到票证齐全、票物相符，报帐及时。2.熟悉和掌握市场行情，按“质优、价廉”的原则货比三家，择优采购。注重收集市场信息，及时向部门领导反馈市场价格和有关信息。合理安排采购顺序，对紧缺物资和需要长途采购的原料应提前安排采购计划及时购进。3.严把采购质量关，物资选择样品供使用部门审核定样，购进大宗物资均须附有质保书和售后服务合同。积极协助有关部门妥善解决使用过程中会出现的问题。4.加强与验收、保管人员的协作，有责任提供有效的物品保管方法，防止物品保管不妥而受损失。5.完成领导交办的其它各项工作。6.要求有较强的抗压能力、沟通能力、时间管理能力。,采购<$&0007&$>采购计划<$&0007&$>采购管理<$&0007&$>五金<$&0007&$>收集市场信息<$&0007&$>采购成本<$&0007&$>报帐<$&0007&$>采购顺序<$&0007&$>采购质量<$&0007&$>物资选择,4-6千,大专,金华市,2024-06-26 00:00:00
452,浙江中科磁业股份有限公司,浙江中科磁业股份有限公司,采购专员,<$&0006&$><$&0007&$>    <$&0006&$><$&0007&$>        1.认真执行公司采购管理规定和实施细则，严格按采购计划采购公司原材料、辅料、五金、建材等以及安排设备采购和维修，做到及时、适用，合理降低物资积压和采购成本。对购进物品做到票证齐全、票物相符，报帐及时。2.熟悉和掌握市场行情，按“质优、价廉”的原则货比三家，择优采购。注重收集市场信息，及时向部门领导反馈市场价格和有关信息。合理安排采购顺序，对紧缺物资和需要长途采购的原料应提前安排采购计划及时购进。3.严把采购质量关，物资选择样品供使用部门审核定样，购进大宗物资均须附有质保书和售后服务合同。积极协助有关部门妥善解决使用过程中会出现的问题。4.加强与验收、保管人员的协作，有责任提供有效的物品保管方法，防止物品保管不妥而受损失。5.完成领导交办的其它各项工作。6.要求有较强的抗压能力、沟通能力、时间管理能力。,采购<$&0007&$>采购计划<$&0007&$>采购管理<$&0007&$>五金<$&0007&$>收集市场信息<$&0007&$>采购成本<$&0007&$>报帐<$&0007&$>采购顺序<$&0007&$>采购质量<$&0007&$>物资选择,4-6千,大专,金华市,2024-12-27 00:00:00
453,中国平安财产保险股份有限公司四川分公司,中国平安财产保险股份有限公司四川分公司,成都-团体综合金融业务部客户经理,<$&0006&$><$&0007&$>    <$&0006&$><$&0007&$>        岗位职责：1. 主要对接以银行、养老险、租赁、不动产等为主的平安系个专业子公司，挖掘团进去到客户资源，开展保险销售；2. 以非车业务拓展为主，开展客户售前、售中、售后全流程服务，包括产品出单以及协调处理承保、理赔过程中的问题；3. 负责本人规模类、品质类、客户类等各项考核指标及业务达成；4. 领导安排的其他相关工作推进。岗位要求：1. 本科及以上学历；2. 具有较强的销售技能、沟通协调能力、创新思维和解决问题的能力；3. 性格积极开朗，有较强学习能力、责任心强；4. 有相关金融行业从业经验者优先，如熟悉保险，及了解金融知识。,,4-6千,本科,成都市,2023-08-11 00:00:00
454,中国平安财产保险股份有限公司四川分公司,中国平安财产保险股份有限公司四川分公司,成都-团体综合金融业务部客户经理,<$&0006&$><$&0007&$>    <$&0006&$><$&0007&$>        岗位职责：1. 主要对接以银行、养老险、租赁、不动产等为主的平安系个专业子公司，挖掘团进去到客户资源，开展保险销售；2. 以非车业务拓展为主，开展客户售前、售中、售后全流程服务，包括产品出单以及协调处理承保、理赔过程中的问题；3. 负责本人规模类、品质类、客户类等各项考核指标及业务达成；4. 领导安排的其他相关工作推进。岗位要求：1. 本科及以上学历；2. 具有较强的销售技能、沟通协调能力、创新思维和解决问题的能力；3. 性格积极开朗，有较强学习能力、责任心强；4. 有相关金融行业从业经验者优先，如熟悉保险，及了解金融知识。,,4-6千,本科,成都市,2023-08-15 00:00:00
455,湖南广信科技股份有限公司,湖南广信科技股份有限公司,行政人事部长,岗位内容：1.全面负责公司行政人事部管理工作，优化部门运营流程；2.制定并完善公司各项管理制度及流程，提高管理效率。3.负责公司日常行政工作，包括企业文化建设、办公环境建设等，促进员工成长和团队建设。4.负责公司安全保卫、环境管理，资产保险、工伤处理、对外事务。5.参与管理公司的员工薪资方案和福利计划；6.分析和解决各类问题，提供解决方案，增加公司管理效益。任职要求：1.具备较强的组织协调与管理能力，有良好的团队领导能力；2.能够正确把握公司战略目标，注重细节和服务质量；3.熟悉环境、安全、劳动、消防、职业卫生等相关法律法规；4.优秀的文字和交流沟通能力；5.本科及以上学历，至少8年以上行政管理经验或相关行业经验优先考虑；6.能适应在总部邵阳和子公司长沙两地工作。,公文撰写会务管理规章制度管理员工关系管理薪酬绩效,8千-1.2万,本科,邵阳市,2025-06-24
456,深圳市强瑞精密技术股份有限公司,深圳市强瑞精密技术股份有限公司,PMC,<$&0006&$><$&0007&$>    <$&0006&$><$&0007&$>        1、 对订单进行评审，对交货期负责，并及时与销售部沟通货期；2、 审核月度生产计划、订单物料需求计划，督促周生产计划执行，并组织生产；3、 对于生产产能负荷分析，调整生产计划；4、 做好生产追踪，跟进，并及时与相关人员沟通协调；5、 统计数据的分析、ERP系统的推动与完善。,erp<$&0007&$>生产计划<$&0007&$>评审<$&0007&$>统计数据<$&0007&$>调整生产计划<$&0007&$>生产追踪<$&0007&$>物料需求计划,6-8千,大专,深圳市,2024-02-19 00:00:00
457,江苏力星通用钢球股份有限公司,江苏力星通用钢球股份有限公司,工艺质保人员,<$&0006&$><$&0007&$>    <$&0006&$><$&0007&$>          %开发与设计机械零部件；  %绘制产品装配图及零部件图；  %负责从设备调试开始到设备的大故障维修的履历管理，内容包括设备基本情况、维修书、改善报告书等相关文件组织填写、归档存位，定期整理工作；  %对图纸、说明书、产品样本进行分类管理，测绘备件、修改图纸并确认与会签；   %制定安装支援计划，验收、调试新设备，并向维修班讲解机械原理及修理要领，解决安装过程中存在的问题；  %制定维修作业计划，制定周、月、年预防维修日历计划，制定点检预防计划；   %制定零部件维修内容、修理方案及技术要求，负责维修车间零部件维修管理工作；                                   %完成部门经理临时交办的其他任务。,工程师<$&0007&$>制程,5-12万/年,大专,南通市,2020-10-21 00:00:00
458,江苏力星通用钢球股份有限公司,江苏力星通用钢球股份有限公司,工艺质保人员,<$&0006&$><$&0007&$>    <$&0006&$><$&0007&$>          %开发与设计机械零部件；  %绘制产品装配图及零部件图；  %负责从设备调试开始到设备的大故障维修的履历管理，内容包括设备基本情况、维修书、改善报告书等相关文件组织填写、归档存位，定期整理工作；  %对图纸、说明书、产品样本进行分类管理，测绘备件、修改图纸并确认与会签；   %制定安装支援计划，验收、调试新设备，并向维修班讲解机械原理及修理要领，解决安装过程中存在的问题；  %制定维修作业计划，制定周、月、年预防维修日历计划，制定点检预防计划；   %制定零部件维修内容、修理方案及技术要求，负责维修车间零部件维修管理工作；                                   %完成部门经理临时交办的其他任务。,工程师<$&0007&$>制程,5-12万/年,大专,南通市,2020-10-21 00:00:00
459,湖南艾华集团股份有限公司,湖南艾华集团股份有限公司,保安,<$&0006&$><$&0007&$><$&0005&$><$&0005&$><$&0005&$><$&0005&$><$&0005&$><$&0005&$>岗位职责：1.检查员工厂牌佩戴、遵章驾驶情况。2.接待外来人员，登记外来人员、迟到人员信息。3.指挥门岗处车辆安全行使。4.检查每日的放行单据。5.登记、签收、派发公务邮件、包裹、报刊、杂志。6.监督废品过秤及装车的全过程。7.参与维护临时食堂就餐纪律。8.处理安保紧急、突发事件。9.办公楼区域消防设施的点检及安全隐患排查。10.食堂购进物质的数量清点与质量的检验。9.清扫责任区域卫生。招聘要求：***，高中以上学历，25-38岁，做事认真负责，170CM以上，有1年以上相关工作经验，退伍军人优先。,五险一金<$&0006&$><$&0007&$><$&0005&$><$&0005&$><$&0005&$><$&0005&$><$&0005&$><$&0005&$><$&0005&$><$&0005&$><$&0005&$><$&0005&$><$&0005&$><$&0005&$><$&0005&$><$&0005&$><$&0005&$><$&0005&$><$&0005&$>带薪年假<$&0006&$><$&0007&$><$&0005&$><$&0005&$><$&0005&$><$&0005&$><$&0005&$><$&0005&$><$&0005&$><$&0005&$><$&0005&$><$&0005&$><$&0005&$><$&0005&$><$&0005&$><$&0005&$><$&0005&$><$&0005&$><$&0005&$>奖金丰厚<$&0006&$><$&0007&$><$&0005&$><$&0005&$><$&0005&$><$&0005&$><$&0005&$><$&0005&$><$&0005&$><$&0005&$><$&0005&$><$&0005&$><$&0005&$><$&0005&$><$&0005&$><$&0005&$><$&0005&$><$&0005&$><$&0005&$>绩效奖金<$&0006&$><$&0007&$><$&0005&$><$&0005&$><$&0005&$><$&0005&$><$&0005&$><$&0005&$><$&0005&$><$&0005&$><$&0005&$><$&0005&$><$&0005&$><$&0005&$><$&0005&$><$&0005&$><$&0005&$><$&0005&$><$&0005&$>全勤奖<$&0006&$><$&0007&$><$&0005&$><$&0005&$><$&0005&$><$&0005&$><$&0005&$><$&0005&$><$&0005&$><$&0005&$><$&0005&$><$&0005&$><$&0005&$><$&0005&$><$&0005&$><$&0005&$><$&0005&$><$&0005&$><$&0005&$>加班补助<$&0006&$><$&0007&$><$&0005&$><$&0005&$><$&0005&$><$&0005&$><$&0005&$><$&0005&$><$&0005&$><$&0005&$><$&0005&$><$&0005&$><$&0005&$><$&0005&$><$&0005&$><$&0005&$><$&0005&$><$&0005&$><$&0005&$>出差补贴<$&0006&$><$&0007&$><$&0005&$><$&0005&$><$&0005&$><$&0005&$><$&0005&$><$&0005&$><$&0005&$><$&0005&$><$&0005&$><$&0005&$><$&0005&$><$&0005&$><$&0005&$><$&0005&$><$&0005&$><$&0005&$><$&0005&$>包吃包住<$&0006&$><$&0007&$><$&0005&$><$&0005&$><$&0005&$><$&0005&$><$&0005&$><$&0005&$><$&0005&$><$&0005&$><$&0005&$><$&0005&$><$&0005&$><$&0005&$><$&0005&$><$&0005&$><$&0005&$><$&0005&$><$&0005&$>高温补贴<$&0006&$><$&0007&$><$&0005&$><$&0005&$><$&0005&$><$&0005&$><$&0005&$><$&0005&$><$&0005&$><$&0005&$><$&0005&$><$&0005&$><$&0005&$><$&0005&$><$&0005&$><$&0005&$><$&0005&$><$&0005&$><$&0005&$>节日福利,,高中,益阳市,2016-05-21 00:00:00
460,华扬联众数字技术股份有限公司,华扬联众数字技术股份有限公司,短视频制作剪辑,<$&0006&$><$&0007&$>    <$&0006&$><$&0007&$>        技能要求：视频编辑，后期编辑，剪辑岗位职责1.负责公司创意小视频（15秒到一分钟）、长视频（3分钟，5分钟或10分钟）的后期剪辑和制作。2.配合编辑参与讨论内容脚本的制作，发掘新选题，收集整理短视频素材。3.熟悉抖音B站等短视频的制作流程，配合编辑完善内容，并保证视频质量、产量。4.完成短视频的特效制作，和编辑一起组织相关内容的拍摄，录制，监督并跟进后期工作。5.对抖音等各种短视频平台的热点内容，有先知先觉的能力，熟练使用网感强的特效动画，音效等。6.对各种素材、包括视频、文字、图片等，按照编辑规定进行有效处理。7.完成公众号内的GIF动图，头图标题设计，海报设计，小程序，H5内容等。职位要求1. 具备三年以上短视频后期剪辑和制作工作经验，有热点嗅觉者优先考虑。2. 熟练使用达芬奇调色、AE、PR、PS、edius等后期软件，最终独立出片。3. 熟练使用各类摄像机、单反及辅助器材。,视频剪辑<$&0007&$>视频制作,0.6-1万/月,本科,,2020-05-22 00:00:00
461,上海海希工业通讯股份有限公司,上海海希工业通讯股份有限公司,销售员（兰州）,任职要求： 1、大专以上学历，电气自动化或相关专业毕业； 2、两年以上相关行业销售或行车电器维修、安装工作经验； 3、甘肃户籍人员优先。 工作职责： 负责区域内工业无线遥控产品的销售工作； 其他： 工作地址：甘肃兰州<$&0005&$><$&0005&$><$&0005&$><$&0005&$><$&0005&$><$&0005&$><$&0005&$><$&0005&$>,直销销售,面议,大专,兰州市,2015-05-15 00:00:00
